id	name	year	title	content	abstract	author
 particle, of charge e, to which various values of the spin and the magnetic moment are attributed. (a) Radiationless collision of mesotrons with electrons. —In Table I is given the cross sections for the scattering of mesotrons by a Coulomb field with a fixed center; in Table II the cross sections for a mesotron in electromagnetic interaction with an electron, in the coordinate system in which the electron is initially at rest. The cross sections are calculated by the well-known method of Mftller, introducing the matrix elements of the interaction of the electron with the electromagnetic field produced, according to the different theories, by the mesotron. In both this process and the process of bremsstrahlung, discussed in (c), we are interested particularly in the case in which the initial energy Bo of the mesotron is large compared with 3IIc'. The results given in Table II and in rows III and V of Table I hold only for this case, giving the leading terms in n=EO/cVc'. In both tables, cases III and IV are one order of magnitude in g greater than I and II, and V is again one order of magnitude larger than III and IV. Both here and for all other processes discussed below the cross sections for a given value of theorder than I and II. The transition probabilities for the Compton effect and the emission process are not independent of each other, for the latter may be also calculated by the method of virtual quanta4' (although for case IV this method must be controlled by the direct method). The virtual quanta method consists in considering the coordinate system in which the mesotron is at rest and taking the Fourier expansion of the field of the quickly moving nucleus. The scattering of a light quantum out of this held, the cross section for which may be taken from the formulae for the Compton effect, then corresponds in the rest system of the nucleus to the emission of a quantum. Very closely connected with the emission of a light quantum is the process of pair generation by a quantum. Indeed, according to the theory of holes, the process involved is of the same kind as the emission process, the only differences being that (in the case of pair production) the light quantum is present in the initial and absorbed in the final state, and that the electron in the initial state has a negative energy. The orders of magnitude of the cross sections for pair-production (Table IVA) are the same as for the corresponding bremsstrahlung processes. Even if the fundamentals of the various theories are correct, some limitation of the validity of the derived results arises from the 40 C. v. 'tA'eiszacker, Zeits. f. Physik 88, 612 (1934). fact that the cross sections as calculated by the perturbation theory are only a first approximation. This is especially important in the cases of spin ~~, with an anomalous magnetic moment, and spin 1 for which particles the cross sections increase with increasing energy. The validity of the first approximation of the perturbation theory in these cases has been discussed by Oppenheimer" and by Landau. " The first author uses the criterion that in the coordinate system in which the mesotron and the light quantum have equal and opposite momenta the interaction energy between the mesotron and the quantum must be small compared with the unperturbed energy of either one. The second author employs the condition that the transition probabilities for all othe' processes that could arise from the same initial state (the emission of several pairs or light quanta, for example) must be small in comparison with the probability for the process in question. For bremsstrahlung, pair generation and the Compton effect, these two criteria give, for cases III and IV, the same condition Eo&(hc/e')Mc' or hv&(hc/e')Mc' " On the other hand, for spin 0 and for spin ~, with normal magnetic moment these criteria are fulfilled for all energies if (Ze'/hc)«1. Although it is clear that these criteria are certainly necessary conditions for the validity of the first approximation of the perturbation theory, a closer investigation of the sufficiency of these conditions (particularly for spin 0) would be desirable. Such an investigation demands a discussion of the higher approximations of the perturbation theory. As these lead to infinities which must be avoided by a suitable cutting-off, the problem is, however, not a purely mathematical one, being connected with the physical problem of the region of applicability of 		W.Pauli
20	Paper13	1975	On the Equations Governing the Perturbations of the Schwarzschild Black Hole	On the Equations Governing the Perturbations of the Schwarzschild Black Hole Author(s): S. Chandrasekhar Source: Proceedings of the Royal Society of London. Series A, Mathematical and Physical Sciences, Vol. 343, No. 1634 (May 13, 1975), pp. 289-298 Published by: Royal Society  On the equations governing the perturbations of the Schwarzschild black hole BY S. CHANDRASEKHAR, F.R.S.  University of Chicago, Chicago, Illinois, 60637 (Received 7 October 1974) A coherent self-contained account of the equations governing the perturbations of the Schwarzschild black hole is given.. In particular, the relations between the equations of Bardeen & Press, of Zerilli and of Regge &  Wheeler are explicitly established. 1. INTRODUCTION  The equations governing the perturbations of the vacuum Schwarzschild metric the Schwarzschild black hole - have been the subject of many investigations (Regge & Wheeler I957; Vishveshwara 1970; Edelstein & Vishveshwara I970; Zerilli Fackerell I97I; Bardeen & Press I972; Friedman I973). Nevertheless, there continues to be some elements of mystery shrouding the subject. Thus, Zerilli (I970a) showed that the equations governing the perturbation, properly analysed into spherical harmonics (belonging to the different I values) and with a  time dependence eiat, can be reduced to a one dimensional Schrodinger equation of (Here, units are used in which c = G - 1.) Accordingly, the reflexion and the transmission coefficients for incident plane waves of various assigned wavenumbers, will clearly suffice 'to determine the evolution of any initial perturbation of the Schwarzschild black hole. This reduction of the general perturbation problem to the elementary one of determining the reflexion and the transmission coefficients of a one dimensional potential barrier is, of course, a remarkable simplification. But what is the origin of the particular form of the potential Vz? Again, considering a particular component of the Riemann tensor - the perturbed  Newman-Penrose 8Jo'-Bardeen & Press (I973) showed that all the physical results relative to the perturbation of the Schwarzschild black hole can equally be derived from the solutions of the equation appropriate for ingoing waves at- the horizon (r* -? - oo) and outgoing wav infinity (r* -> + oo). If, as claimed, the physical contents of equations (1) and (4) entirely the same, then there must be a simple relation between the functions Z  and 0 which makes this equivalence manifest. But what is this relation? In this paper we shall give a coherent, self-contained account of the theory of the  perturbations of the Schwarzschild black hole while resolving at the same time some  of the unanswered questions, in particular, the relation between the Zerilli and the Bardeen-Press equations..  2. THE EQUATIONS GOVERNING THE PERTURBATIONS OF THE SCHWARZSCHILD BLACK HOLE  The vacuum metric of Schwarzschild written in its standard form is  ds2 =- (1- )(dt)2+r2sin2O(dy)2? (dr)2 +r2(dO)2. (6) Because of this spherical symmetry, first order perturbations of this metric can be analysed into spherical harmonics belonging to the different I and m values. Perturbations belonging to a particular I and m will be axisymmetric about some axis. Accordingly, there will be no loss of generality in restricting ourselves to axisymmetric perturbations from the outset.  As has been shown (Chandrasekhar & Friedman 1972) a form of the metric adequate for treating time-dependent axisymmetric systems in general relativity is where v V', 2, 3, w, q2, and q3 are all functions of t and the spatial variables x2 and x3 but independent of the azimuthal angle y. WVith the identifications  the Schwarzschild metric corresponds to the various metric functions having the values When the metric is perturbed, we shall write for the corresponding metric functions while w, q2, and q3 will be considered as quantities of the first order of smallness like bv, 8A, 85f, and b4a3. The equations governing the various quantities describing the perturbations can  be readily written dowvn by transcribing in the present context the various equations This equation follows from Chandrasekhar & Friedman (1972; equation (153)) by substituting for i/i, v, etc., their present values. We observe that (1 1 b) is independent of the other field variables: it governs the 'so-called' odd-parity perturbations.  Equation (11b) is considered in the appendix. Of the remaining field equations, it will suffice to consider the (0, 2)-, (0, 3)-, (2,3)-, and (2,2)-components. These equations are where we have further assumed a time dependence exp With the foregoing substitutions, equation (13) at once gives Similarly, equations (15) and (16) give Equation (23), after the elimination of T, takes the form It will be observed that equations (21), (22), and (25) provide three linear first order equations for the three radial functions L, N, and V. By suitably combining  them, we can express the derivative of each of them as linear combinations of L, N, Equations (27), (28), and (29) provide the basic equations of the theory. All the remaining field equations, including equation (24), are verifiable consequences of these equationst For later use, we may note here the following equation obtained by adding equations (28) and (29) 3. ZERILLI'S EQUATION  We shall verify that by virtue of equations (27)-(29), the function, satisfies Zerilli's equation (1).  First, we observe that an equivalent expression for Z is r2  Z =rV-2 (L+ X). (34) nr + 3m Differentiating this expression with respect to the variable  r =r+2mlg (rm1) (r > 2m), (35) t In Regge & Wheeler's discussion (Regge & Wheeler I957) of this same problem, in a  gauge different from the one adopted in this paper, the corresponding situation is somewhat curious. They obtain a set of six equations for three scalar functions. Three of these equations are of the first order while the remaining three are of the second order. They say 'one will expect that the three first order equations will suffice to determine the solution apart from the boundary conditions. Actually, the second order equations contain an additional piece of information... specifically, a rather elaborate investigation shows that [the second order equations] can all be deduced from [the first order equations]' provided a linear combination, F (say), of the three scalar functions vanishes. At the same time Vishveshwara (I970) says that if F, is evaluated with the aid of the first order equations, F, P --V,F and that therefore 'if F = 0 for some r, it is zero everywhere'. All this is somewhat confusing. In any event, when working in the gauge adopted in this paper, all the second order equations are identically satisfied by virtue of the first order equations (27)-(29) and no 'additional piece of information' is provided.  Differentiating this last expression., once again, with r with the aid of equations (24), (29), and (34), we find after some considerable reductions that, remarkably, we are left with  d2Z/dr2 +(o2-VVZ)Z Z0, (37) where Vz is given by equation (2). Thus, Zerilli's equation, while it is a directly verifiable consequence of equations (27)-(29), the manner in which it emerges is shrouded in (apparently) miraculous cancellations.  An interesting integral property of Zerilli's potential Vz may be noted here: 4. THE EXPRESSION OF WF0 IN TERMS OF ZERILLI'S FUN-CTION  In another connexion, Friedman (1973; ? 3 of this paper) has already cons  the perturbed components of the Riemann tensor; and the component 5W. the Bardeen-Press equation (4) refers is Expressions for the components of the Riemann tensor (in the tetrad-frame in whieh they are referred) have been given by Chandrasekhar & Friedman (I 972; equations (16)) under general time-dependent axisymmetric conditions. Specializing them to  the case on hand, we find that in accordance with equationi (39) (cf. Friedmr3a: 11973, equation (56))  In the further use of this expression, we shall suppress the angular dependence  (I, -P 0 cot 0) and the factor 2 eit as well. With this understanding, we can rewrite  the expression for B&1' in the following form after eliminating Kr in the sec in parenthesis on the right hand side with the aid of equation (29):   Making use of equations (34) and (36) giving Z and Z,,,we find that we ean express b&I" in terms of these quantities; we find We observe that in the first term in braces on the right hand side of equa  the coefficient of Z is, apart from a factor r2/(r - 2m) the potential V equation. In making use of this fact we shall find it convenient to introduce the operators We now rewrite the expression (43) for 8PJ in the manner Equation (47) suggests that we define the fiun  It is noteworthy that in this last equation, expr appears as the coefficient of Z.  Perturbations of the Schwarzschild black hole 297 On simplifying this last equation, we are left with  it can now be readily verified that we recover equation (4) of Bardeen & Press.  Even as equations (56) and (57), together with Zerilli's equation, enabled us to derive the Bardeen-Press equation, we may, conversely, derive Zerilli's equation from equations (51) and (55) together with the Bardeen-Press equation in the form (61). 6. CONCLUDING REMARKS  In bringing together in a common framework the different equations which govern  the perturbations of the Schwarzschild black hole and clarifying their inner relation, the present paper raises the question whether one may not be able to simplify some, at least, of the aspects of the perturbation problem as it pertains to the Kerr black  hole. Thus, Teukolsky's equation (Teukolsky I973) governing the perturbations of  the Kerr black hole reduces, when specialized to the Schwarzschild black hole, to the Bardeen--Press equation (4) and not to the Zerilli equation (1). The question naturally arises whether there may not be a transformed version of the Teukolsky  equation, which when specialized to the Schwarzschild case becomes the Zerilli equation. Such a transformation, if it were possible, would clearly be advantageous: we shall then need to determine only the reflexion and the transmission coefficients  for a one-dimensional potential barrier. In a subsequent paper (Chandrasekhar & Detweiler, in preparation) it will be shown how Teukolsky's equation, for the case  of axisymmetric perturbations, can be transformed into a one-dimensional wave equation with, indeed, four possible potentials. The research reported in this paper has in part been supported by the National  Science Foundation under grant GP-34721X1 with the University of Chicago and the Louis Block Fund.  In the course of an investigation of Teukolsky's equation (Chandrasekar & Detweiler, in preparation), it became clear that the Regge-Wheeler equation governing the odd-parity perturbations of the Schwarzschild metric must also be equivalent to the Bardeen-Press equation. We give a brief ab initio demonstration of this equivalence.  The variables r and 0 in equation ( 11 b), governing the odd-parity perturbations, can be separated by the substitution,  Q = rX(r)P1+2(cos0/-3),	 A coherent self-contained account of the equations governing the pertur-  bations of the Schwarzschild black hole is given.. In particular, the relations  between the equations of Bardeen & Press, of Zerilli and of Regge &  Wheeler are explicitly established.	 S. Chandrasekhar
