id	name	year	title	content	abstract	author
1	Paper1	1948	theory of Gravitation	REVI EWS OF MOD ERN  PHYSICS VOLUME 20, NUM HER  JANUARY, 1948  1  Gravitation  ALBERT EINSTEIN  Institute for Advanced Study, Princeton, New Jersey '  'N the following we shall give a new presenta-  tion of the generalized theory of gravitation, which constitutes a certain progress in clarity as compared to the previous presentations. * It is our aim to achieve a theory of the total field by a generalization of the concepts and methods of the relativistic theory of gravitation.  i. THE  The determinant Proof:  If we decompose g, & into its real and imaginary components, then the former is a symmetric tensor (g;&), the latter an antisymmetric tensor (gp). The g;s are still functions of the real variables x~, . ~, x4. The formally natural character of this generalization of the symmetric tensor becomes particularly noticeable by the following consideration: From the covariant vector A; one can form through multiplication the particular symmetric covariant tensor A&s. From such tensors every symmetric tensor of rank 2 can be obtained through summation with real coefficients:  In an analogous manner we form from a complex vector A; the special Hermitian tensor A;As (remains fixed if we interchange i and k and take the complex conjuga, te). We then get the representation of a general Hermitian tensor  * A. Einstein, "A generalization of the relativistic theory Ann. Math. 46 (1945); A. Einstein and of gravitation, E. G. Straus, "A generalization of the relativistic theory of gravitation II, Ann. Math. 4'7 (1946).  We can associate a contravariant g' to the covariant g;k just as in the case of real fields by setting    In the generalized theory the total field is represented by a Hermitian tensor. The symmetry property of the (complex) g;& is    where the c are again real constants.  FIELD STRUCTURE  The theory of gravitation represents the field by a symmetric tensor  where the g, t ar e real functions of  where b is the Kronecker tensor. Here the order of indices is important and, for example, g;,g" does not equal 8 . In the following the tensor density g'" =g's(g) & plays an important role. From a group theoretical point of view the introduction of a Hermitian tensor is somewhat arbitrary, since both individual additive components gk and g@ have tensor character. However, this flaw is somewhat ameliorated by the fact that, just as in the case of real fields, there is a natural way of associating parallel translations to the Hermitian gg„ this is the main basis for the c1aim that the introduction of a Hermitian gg, is natural.  2. INFINITESIMAL PARALLEL TRANSLATIONS, ABSOLUTE DIFFERENTIATION AND CURVATURE  In the theory of real fields we give the inparallel translation of a vector A' or   with a corresponding introduction of infinitesimal parallel translations for tensors of higher rank. The second equation of (I) is connected with the first by the demand that   ALBERT EINSTFIN From (1) we get in the well-known the tensor character of  manner  where the I" will, in general, also be complex, aiid pass to the complex conjugate of this equation then we see that we have there an equation which also dehnes a parallel translation, but this parallel translation may dier from the first. We define then two kinds of parallel translation  derivative  of  In order to obtain the covarian multiplying the first equation by Ak, the second by A; and adding we get and since g;k can be constructed such special tensors we get and  In order that conjugate vectors have conjugate translations and derioatkies it is necessary upon passage to the conjugate to change the character of translationor of diff'e, rentiation, i.e. , to pass to tke conjugate F. In order to obtain the covariant derivative of a Hermitian tensor we write in analogy to the real case: The I ale now deteinlliled frolil the g and their 6rst derivatives by the demand that the absolute derivative of the g;k vanish  two kinds of covariant and, correspondingly, diB'erentiation   However, since the g,k are symmetric, these are only 40 equations for the 64 F. In order to complete the determination of the j.' one uses the only possible invariant algebraic condition, namely, the condition of symmetry  We now transfer this development to the complex case by defining parallel translation as in (1). However, this gives rise to a. certain complication, since if we start from the translation of a complex vector,  These equations are Hermitian in the indices into themselves if we interchange i, k and i, pass to the conjugate complex) and therefore again do not suKce to determine the complex r. In analogy to (4) we have as the only possible invariant algebraic determination the condition of Hermiticity  which implies both (3a) and (4a). Absolute digerenticttion of vector densities. If we 'g'" and sum over i and k, then multiply (3b) by —, we get the vector equation a scalar density, the left side of (3c) is a vector density. The latter will also hold if (g) is replaced by an arbitrary scalar density p. We may therefore introduce as the absolute derivative of a scalar density p.' (g)'* is  This permits us to introduce absolute diEerentiation of tensor densities. Example: If we multiply the right side of the equation or, after introducing  the vector density  Just as in the case of real fields we can bring (3a) into a contravariant form; however, we have to be careful about the order of indices. We obtain the equivalent equations  The Eqs. (3a), (3d), and (3e) are equivalent. Curvature: The change which a vector undergoes upon parallel translation around the boundary curve of an infinitesimal element of area has vector character. This leads to the formation of a curvature tensor also in the case of our generalized field. We have here the choice whether to translation or a translation; howuse a ever, the results of the two translations are conjugate complex, so that it suffices to consider one form. We obtain ihe tensor  and the corresponding contracted traction with respect to i and in)  There also exists a non-vanishing contraction with respect to i and k which yields the tensor er, we sha11 not use this tensor as we sha11 j ustify later. The tensor R && is not Hermitian. We form the Hermitian tensor R;k —2(R*;k+R*k;). We thus get  Since the last term is a tensor density, the term in brackets is also a tensor density which we may  derivative  In an analogous manner we may define the absolute derivatives of arbitrary tensor densities. They diGer from the absolute derivative of the  PRINCIPLE FIELD EQUATIONS  3. HAMILTONIAN  satisfy this t'dentscal/y'lt  In the case of the real symmetric 6eld one obtains the field equations most simply in the following manner. We use as Hamilton function the scalar density  If we vary the volume integral of @ independently with respect to I" and g, then (in the case of real. fields) variation with respect to I' yields Eq. (3), and variation with respect to g yields the equations ~;~=0. If we apply the same method to our case of a complex field (where @ is still real) then we see a complication, since the variation with respect to I' does not immediately yield Eq. (3a), which we wish to keep in any case. The variation with respect to F yields time being. We can resolve this difficulty in the following manner. We form the imaginary part of (11):  If we contract this equation and a we get  From this we can deduce that the necessary and sufficient** condition for the vanishing of the I" is the vanishing of the g'"', , In order to **This holds for a11 points if we demand that the I' be continuous and determined uniquely by the equations (3b); because then the determinant ary independently with respect to the 1', and g'~'. The variation with respect to the I' then yields (3a), as we have shown. The variation with respect to. the other quantities yields the equations  g'" is a tensor density which is antisymmetric in all three indices. That is, we require that g'-' be derived from a "vector potential. We therefore substitute in the Hamilton function The first bracket is g+ the second and third brackets are contractions of this quantity. If there were no fourth bracket then (11) would of g+-', that is, (Ba). imply the vanishing However, this would require the vanishing of I' & to which demand we have no right for the  Considering (3a), each of the systems (16), (17) implies the other; this is proven by showing that (3a) implies the equation  is therefore not weakened if we omit (17). This is worth mentioning also for the following reason. While in the given derivation of the equations, special emphasis is given to the density g" rather than to the tensor g, k (or g'k), the resultingsystem itself is free of such discrimination. We now see that because of (16) the tensor (9) reduces to I' ~, — , ~, which vanishes because  The system of 6eld equations   The derivation used here has the advantage, as compared to the previous one, that the Hamiltonian principle used is one without side conditions. This behavior is the same as that encountered in a (specially relativistic) derivation of Maxwell's equations from a variational principle. There (for imaginary time coordinate) the  Hamiltonian set here yq=y;, g —qp, ; and. vary with respect GENERALIZED  THEORY OF GRAVITATION  to the q, , then we get the one system of equations (y@,i, =0)  directly, the other through elimination of the y;. This method corresponds to the one used above. One may, however, avoid the introduction of the potentials p; and instead adjoin the system of equations    as side conditions for the y@ in the variation. This corresponds to the treatment of g", , =0 as side condition for the variation in the previous paper. The side condition I"& —0 which was introduced there could have been omitted. REMARKS  In order to preserve the special character of locally space-like and time-like directions it is essential that the index of inertia of gikdx'dxk be the same everywhere, i.e. , that the determinant (gg, vanish nowhere. This can indeed be ~  deduced from the requirement that the I'-field be finite and determined everywhere by Eq. (3a). My assistant has given the following simple proof  of this: If the determinant  point P then there would exist a vector P different from 0, such that g;.P =0. We now consider the real part of Eq. (3a): mark that the antisymmetric density g'k' plays the role of an electromagnetic vector potential, the tensor g@, i+g~, i+g@, i, the role of current density. The latter quantity 'is the "complement" of a contravariant vector density with (identically) vanishing divergence. Above we have used complex fields. However, there exists a theoretical possibility in which the g;i,. and I', q are real though not symmetric. Thus one can obtain a theory which in its final formulas corresponds, except for certain signs, to the one developed above. E. Schrodinger, too, has based his affine theory (i.e. , based on the I" as fundamental field quantities) on real fields. I therefore wish to give here some formal reasons for the preferability of complex 6elds. A Hermitian tensor g;i, can be constructed additively from vectors according to the scheme with the use of one complex vector A; one can construct the Hermitian tensor A;Ak through multiplication, which is a close analogy to the case of symmetric real fields. A nonsymmetric real tensor cannot be constructed from vectors in such close analogy. We now consider translation quantities F';i,. which are not symmetric in the lower indices. To them we have in both the real and the complex cases the adjoined ("conjugate" ) translation quantities I';k = I'k;. In the complex case we have associated with the parallel translation of a  If we multiply this equation (at the point P) by P$"$' and sum over i, k, I, then the second and  vector  third terms vanish by definition of P, and the fourth and fifth because of the antisymmetry of the I'. There exists, therefore, a linear combination of Eq. (Ba) which does not contain the I'. Hence at such a point the I' either become infinite or not completely determined, in contradiction to our requirement. Concerning the physical interpretation we re-  the parallel translation vector  Hence in the case of complex fields the adjoined translation corresponds to adjoined objects, while in the case of real fields there is no such adjoined object.		
2	Paper2_1	2018	PRINCIPAL COMPONENT ANALYSIS AS A TOOL FOR CHARACTERIZING BLACK HOLE IMAGES AND